{
  "slug": "funcion-vina-del-mar-2026-09-01",
  "type": "event",
  "title": "Función",
  "kind": "funcion",
  "work": null,
  "company": null,
  "organizer_text": null,
  "disciplines": [],
  "audience": null,
  "description_md": null,
  "price": null,
  "is_free": null,
  "booking_url": null,
  "accessibility": [],
  "occurrences": [
    {
      "starts_at": "2026-09-01T19:00:00-03:00",
      "ends_at": null,
      "time_unknown": false,
      "venue": "teatro-municipal-de-vina-del-mar",
      "place": null,
      "price": null,
      "note": null
    }
  ],
  "last_checked_at": "2026-09-08",
  "media": [],
  "sources": [
    {
      "url": "https://teatrovina.cl/",
      "title": "Teatro Municipal Viña del Mar (sitio oficial)",
      "publisher": "Teatro Municipal de Viña del Mar — Municipalidad de Viña del Mar",
      "type": "oficial",
      "level": 1,
      "role": "primaria",
      "accessed_at": "2026-09-08",
      "archived_url": null,
      "supports": [],
      "notes": "Consultado en septiembre de 2026: dirección, contacto institucional y programación del mes."
    }
  ],
  "verification": {
    "status": "pendiente",
    "confidence_score": 60,
    "verified_at": null,
    "verified_by": null,
    "next_review_at": null,
    "note": "Importado del catastro regional del ecosistema teatral (Fase 1: descubrimiento); pendiente de verificación editorial."
  },
  "published": false
}
