{
  "slug": "hipodermica-valparaiso-2025-05-06",
  "type": "event",
  "title": "Hipodérmica",
  "kind": "funcion",
  "work": "hipodermica",
  "company": "astillero-teatro",
  "organizer_text": null,
  "disciplines": [
    "teatro"
  ],
  "audience": null,
  "description_md": null,
  "price": null,
  "is_free": null,
  "booking_url": null,
  "accessibility": [],
  "occurrences": [
    {
      "starts_at": "2025-05-06T19:00:00-03:00",
      "ends_at": null,
      "time_unknown": false,
      "venue": "centro-cultural-ipa",
      "place": null,
      "price": null,
      "note": null
    }
  ],
  "last_checked_at": "2026-09-08",
  "media": [],
  "sources": [
    {
      "url": "https://centex.cultura.gob.cl/con-ocho-montajes-en-ocho-espacios-distintos-valparaiso-celebra-mes-del-teatro/",
      "title": "Ciudad Teatro: con ocho montajes en ocho espacios distintos Valparaíso celebra el Mes del Teatro",
      "publisher": "Centex — Centro de Extensión del Ministerio de las Culturas, las Artes y el Patrimonio",
      "type": "institucional",
      "level": 1,
      "role": "primaria",
      "accessed_at": "2026-09-08",
      "archived_url": null,
      "supports": [],
      "notes": "Nota de 2025 con programa completo: 8 funciones entre el 5 y el 11 de mayo de 2025 en Valparaíso. Gratuidad no especificada."
    }
  ],
  "verification": {
    "status": "pendiente",
    "confidence_score": 60,
    "verified_at": null,
    "verified_by": null,
    "next_review_at": null,
    "note": "Importado del catastro regional del ecosistema teatral (Fase 1: descubrimiento); pendiente de verificación editorial."
  },
  "published": false
}
