{
  "slug": "intoxicadas-valparaiso-2026-05-24",
  "type": "event",
  "title": "Intoxicadas",
  "kind": "funcion",
  "work": "intoxicadas",
  "company": "compania-en-panos-menores",
  "organizer_text": null,
  "disciplines": [
    "teatro"
  ],
  "audience": null,
  "description_md": null,
  "price": null,
  "is_free": null,
  "booking_url": null,
  "accessibility": [],
  "occurrences": [
    {
      "starts_at": "2026-05-24T19:00:00-03:00",
      "ends_at": null,
      "time_unknown": false,
      "venue": "sala-de-artes-escenicas-rodelillo",
      "place": null,
      "price": null,
      "note": null
    }
  ],
  "last_checked_at": "2026-09-08",
  "media": [],
  "sources": [
    {
      "url": "https://g5noticias.cl/2026/05/07/ciudad-teatro-2026-vuelve-el-encuentro-territorial-de-teatro-porteno-con-8-montajes-en-20-dias-a-precios-populares/",
      "title": "CIUDAD TEATRO 2026: Vuelve el encuentro territorial de teatro porteño con 8 montajes en 20 días a precios populares",
      "publisher": "G5noticias",
      "type": "prensa",
      "level": 2,
      "role": "primaria",
      "accessed_at": "2026-09-08",
      "archived_url": null,
      "supports": [],
      "notes": "Nota del 7 de mayo de 2026. Programa completo del 8 al 28 de mayo de 2026; organiza Sala Pascal 79 con financiamiento PAOCC. No indica precios ni direcciones escénicas."
    }
  ],
  "verification": {
    "status": "pendiente",
    "confidence_score": 60,
    "verified_at": null,
    "verified_by": null,
    "next_review_at": null,
    "note": "Importado del catastro regional del ecosistema teatral (Fase 1: descubrimiento); pendiente de verificación editorial."
  },
  "published": false
}
