{
  "slug": "trenzando-puntos-de-fuga",
  "type": "event",
  "title": "Trenzando Puntos de Fuga",
  "kind": "festival",
  "work": null,
  "company": null,
  "organizer_text": "Red Ramal Cultural, con la Seremi de las Culturas, las Artes y el Patrimonio y municipalidades participantes",
  "disciplines": [],
  "audience": null,
  "description_md": null,
  "price": null,
  "is_free": null,
  "booking_url": null,
  "accessibility": [],
  "occurrences": [
    {
      "starts_at": "2026-09-05T00:00:00-03:00",
      "ends_at": null,
      "time_unknown": true,
      "venue": null,
      "place": null,
      "price": null,
      "note": null
    }
  ],
  "last_checked_at": "2026-09-08",
  "media": [],
  "sources": [
    {
      "url": "https://g5noticias.cl/2026/09/04/puntos-de-fuga-llega-este-sabado-a-la-calera-con-musica-teatro-y-folclor-de-tres-comunas/",
      "title": "Puntos de Fuga llega este sábado a La Calera con música, teatro y folclor de tres comunas",
      "publisher": "G5noticias",
      "type": "prensa",
      "level": 2,
      "role": "primaria",
      "accessed_at": "2026-09-08",
      "archived_url": null,
      "supports": [],
      "notes": "Nota del 4 de septiembre de 2026. 'Trenzando Puntos de Fuga' es una iniciativa de la Red Ramal Cultural articulada con la Seremi de las Culturas y las municipalidades; 2025 primera etapa, 2026 segunda con 12 comunas: Quintero, Concón, Zapallar, Olmué, La Calera, Quillota, Papudo, Petorca, Cabildo, Puchuncaví, La Cruz y Limache."
    }
  ],
  "verification": {
    "status": "pendiente",
    "confidence_score": 35,
    "verified_at": null,
    "verified_by": null,
    "next_review_at": null,
    "note": "Importado del catastro regional del ecosistema teatral (Fase 1: descubrimiento); pendiente de verificación editorial."
  },
  "published": false
}
