{
  "slug": "concon-el-regreso-concon-2024-01-13",
  "type": "event",
  "title": "Concón el Regreso",
  "kind": "funcion",
  "work": "concon-el-regreso",
  "company": "ucronia-teatral",
  "organizer_text": null,
  "disciplines": [
    "teatro"
  ],
  "audience": null,
  "description_md": null,
  "price": null,
  "is_free": true,
  "booking_url": null,
  "accessibility": [],
  "occurrences": [
    {
      "starts_at": "2024-01-13T21:00:00-03:00",
      "ends_at": null,
      "time_unknown": false,
      "venue": "patio-de-los-copihues-iglesia-nuestra-senora-de-las-mercedes",
      "place": null,
      "price": null,
      "note": null
    }
  ],
  "last_checked_at": "2026-09-08",
  "media": [],
  "sources": [
    {
      "url": "https://valparaisoregion.org/tour/obra-de-teatro-concon-el-regreso-concon/",
      "title": "Obra de teatro Concón el regreso — Concón",
      "publisher": "valparaisoregion.org (directorio turístico)",
      "type": "directorio",
      "level": 3,
      "role": "primaria",
      "accessed_at": "2026-09-08",
      "archived_url": null,
      "supports": [],
      "notes": "Ficha de evento sin año: 'sábado 13 de enero, 21:00' (el 13 de enero cayó sábado en 2024; año inferido, por confirmar). Patio de los Copihues, Iglesia Nuestra Señora de Las Mercedes, Av. Marotto 950, Concón; entrada liberada."
    }
  ],
  "verification": {
    "status": "pendiente",
    "confidence_score": 35,
    "verified_at": null,
    "verified_by": null,
    "next_review_at": null,
    "note": "Importado del catastro regional del ecosistema teatral (Fase 1: descubrimiento); pendiente de verificación editorial."
  },
  "published": false
}
