{
  "slug": "la-tendala-san-antonio-2026-04-19",
  "type": "event",
  "title": "La Tendalá",
  "kind": "funcion",
  "work": "la-tendala",
  "company": "cooperativa-de-artes-escenicas-de-valparaiso",
  "organizer_text": null,
  "disciplines": [
    "teatro"
  ],
  "audience": null,
  "description_md": null,
  "price": null,
  "is_free": true,
  "booking_url": null,
  "accessibility": [],
  "occurrences": [
    {
      "starts_at": "2026-04-19T18:00:00-03:00",
      "ends_at": null,
      "time_unknown": false,
      "venue": "centro-cultural-san-antonio",
      "place": null,
      "price": null,
      "note": null
    }
  ],
  "last_checked_at": "2026-09-08",
  "media": [],
  "sources": [
    {
      "url": "https://centrocultural.sanantonio.cl/index.php/item/3077-destacadas-obras-trae-a-san-antonio-el-festival-litoral-teatral-2026",
      "title": "Destacadas obras trae a San Antonio el Festival Litoral Teatral 2026",
      "publisher": "Centro Cultural San Antonio",
      "type": "oficial",
      "level": 1,
      "role": "primaria",
      "accessed_at": "2026-09-05",
      "archived_url": null,
      "supports": [],
      "notes": "Confirma 13 compañías, 12 espectáculos y las funciones del 19, 25 y 26 de abril de 2026."
    }
  ],
  "verification": {
    "status": "pendiente",
    "confidence_score": 60,
    "verified_at": null,
    "verified_by": null,
    "next_review_at": null,
    "note": "Importado del catastro regional del ecosistema teatral (Fase 1: descubrimiento); pendiente de verificación editorial."
  },
  "published": false
}
