{
  "slug": "morro-producciones-santiago-aniversario-278-de-san-felipe-compania-de-otra-region-sin-registro-propio-san-felipe-2018-08-25",
  "type": "event",
  "title": "Morro Producciones (Santiago), aniversario 278 de San Felipe; compañía de otra región, sin registro propio.",
  "kind": "funcion",
  "work": null,
  "company": null,
  "organizer_text": null,
  "disciplines": [],
  "audience": null,
  "description_md": "Morro Producciones (Santiago), aniversario 278 de San Felipe; compañía de otra región, sin registro propio.",
  "price": null,
  "is_free": null,
  "booking_url": null,
  "accessibility": [],
  "occurrences": [
    {
      "starts_at": "2018-08-25T12:00:00-03:00",
      "ends_at": null,
      "time_unknown": false,
      "venue": "teatro-municipal-de-san-felipe",
      "place": null,
      "price": null,
      "note": null
    }
  ],
  "last_checked_at": "2026-09-08",
  "media": [],
  "sources": [
    {
      "url": "https://www.elinformador.cl/comunas-de-aconcagua/hasta-el-teatro-municipal-de-san-felipe-llegara-toda-la-magia-de-aladino/",
      "title": "Hasta el Teatro Municipal de San Felipe llegará toda la magia de Aladino",
      "publisher": "El Informador (Aconcagua)",
      "type": "prensa",
      "level": 2,
      "role": "primaria",
      "accessed_at": "2026-09-08",
      "archived_url": null,
      "supports": [],
      "notes": "Nota del 22 de agosto de 2018: 'Aladino' de Morro Producciones (Santiago), sábado 25 de agosto de 2018, 12:00, aniversario 278 de San Felipe."
    }
  ],
  "verification": {
    "status": "pendiente",
    "confidence_score": 60,
    "verified_at": null,
    "verified_by": null,
    "next_review_at": null,
    "note": "Importado del catastro regional del ecosistema teatral (Fase 1: descubrimiento); pendiente de verificación editorial."
  },
  "published": false
}
